{
  "authority": {
    "mayAuthorizeImplementation": false,
    "mayCreateClaims": false,
    "providerOutputOnly": true,
    "requiresLocalPromotion": true
  },
  "changed": false,
  "inputSha256": "e3b0c44298fc1c149afbf4c8996fb92427ae41e4649b934ca495991b7852b855",
  "liveNotebookLMExecuted": false,
  "outputSha256": "e3b0c44298fc1c149afbf4c8996fb92427ae41e4649b934ca495991b7852b855",
  "redactions": [],
  "schemaVersion": "notebooklm-redaction-report-v0",
  "totalRedactions": 0
}
